{
  "schemaVersion": "1.0.0-draft.1",
  "contractKind": "evidence-envelope",
  "evidenceId": "evidence_333333333333333333333333",
  "digest": "sha256:3333333333333333333333333333333333333333333333333333333333333333",
  "projectSnapshot": "sha256:0000000000000000000000000000000000000000000000000000000000000000",
  "catalogSnapshot": "sha256:1111111111111111111111111111111111111111111111111111111111111111",
  "policySnapshot": "sha256:2222222222222222222222222222222222222222222222222222222222222222",
  "routePlan": {
    "id": "route_1",
    "digest": "sha256:4444444444444444444444444444444444444444444444444444444444444444"
  },
  "executionPlan": {
    "id": "plan_1",
    "digest": "sha256:5555555555555555555555555555555555555555555555555555555555555555"
  },
  "checks": [
    {
      "id": "unit",
      "required": true,
      "status": "passed",
      "diagnostics": [],
      "artifacts": ["sha256:6666666666666666666666666666666666666666666666666666666666666666"]
    }
  ],
  "unverified": []
}
